{
  "schemaVersion": 1,
  "title": "A Small Art of Attention",
  "author": "The Chapterlet Editors",
  "description": "An original little book about noticing more, making room for thought, and finding a reading rhythm of your own.",
  "kind": "notes",
  "language": "en",
  "tags": ["Attention", "Everyday life"],
  "chapters": [
    {
      "title": "An Open Window",
      "paragraphs": [
        "Before the day becomes a list, it is a room. There is light on the wall, a sound from the street, and perhaps a cup that is still warm enough to hold in both hands. Nothing extraordinary has happened. There is already something to notice.",
        "**Attention is a small act of welcome.** We make space for one thing to be fully present: a sentence, a person, the shape of a leaf. We do not need to turn every observation into a lesson. Sometimes seeing clearly is enough.",
        "A window does not create the landscape. It gives the landscape a frame. In much the same way, a few quiet minutes can frame an ordinary morning and make its details available to us.",
        "Try looking at a familiar object for one full minute. Notice its edges, its weight, and the way its colour changes in shadow. If your mind wanders, let it return without ceremony. The practice begins again with each return.",
        "There is no perfect state of concentration waiting at the end of this exercise. There is only a growing willingness to look. That willingness can travel with us into reading, conversation, and work."
      ]
    },
    {
      "title": "The Margin of a Page",
      "paragraphs": [
        "A book is a conversation with generous pauses. We can stop after a sentence, carry it to the kitchen, and come back later. The page does not hurry us. Its silence is part of what it offers.",
        "When a phrase catches your attention, ask what made it catch. Was it a new idea, a familiar feeling, or a useful disagreement? A short note can preserve the question even when an answer has not arrived.",
        "*Write to remember your encounter with the idea.* A note does not have to summarise the entire chapter. It might say, ‘This reminds me of the walk by the river,’ or simply, ‘I am not convinced yet.’ Both are honest beginnings.",
        "The margin is also a place for connections. Two ideas read weeks apart may suddenly meet there. Keep the original words alongside your response so that later you can distinguish the author's thought from your own.",
        "A useful reading habit might fit into a single line: `read → pause → notice`. It is not a productivity formula. It is permission to give a small amount of reading your full consideration."
      ]
    },
    {
      "title": "A Rhythm to Return To",
      "paragraphs": [
        "A sustainable rhythm leaves room for ordinary life. Some evenings will hold a whole chapter; others will hold three paragraphs. The smaller reading still counts because the relationship with the book continues.",
        "Choose a cue you already encounter: the lamp beside a chair, the end of lunch, or the quiet after a train departs. Let that cue invite a little reading. An invitation is easier to return to than a demand.",
        "Keep a bookmark where you stopped. Tomorrow, begin a paragraph earlier. This small overlap restores the thread and makes returning feel natural. The purpose of a saved place is to make the next beginning easier.",
        "Your library can be modest. A few books that matter to you are a better starting point than a collection assembled out of obligation. Keep what invites your curiosity; allow your interests to change.",
        "For more freely available reading, you can visit [Project Gutenberg](https://www.gutenberg.org/) when you are online. External links open only when you choose them; the pages of this little book remain on your device.",
        "At the end of a chapter, look up. The room is still here. Perhaps a detail has changed, or perhaps you have. Close the book when you are ready. It will be waiting when you return."
      ]
    }
  ]
}
